----------------------------------------------------------------------------
CrystalDiskInfo 9.4.4 (C) 2008-2024 hiyohiyo
                                Crystal Dew World: https://crystalmark.info/
----------------------------------------------------------------------------

    OS : Windows 11 Pro 23H2 [10.0 Build 22631] (x64)
  Date : 2024/09/28 18:02:36

-- Controller Map ----------------------------------------------------------
 - 標準 SATA AHCI コントローラー [ATA]
 + 標準 NVM Express コントローラー [SCSI]
   - INTEL SSDPEKNU512GZ
 - Microsoft 記憶域コントローラー [SCSI]
 + 標準 NVM Express コントローラー [SCSI]
   - SUNEAST SE900NVG3Q 1024G

-- Disk List ---------------------------------------------------------------
 (01) SUNEAST SE900NVG3Q 1024G : 1024.2 GB [1/2/0, sq] - nv
 (02) INTEL SSDPEKNU512GZ : 512.1 GB [0/1/0, sq] - nv

----------------------------------------------------------------------------
 (01) SUNEAST SE900NVG3Q 1024G
----------------------------------------------------------------------------
           Model : SUNEAST SE900NVG3Q 1024G
        Firmware : 400fAA12
   Serial Number : 30086154230
       Disk Size : 1024.2 GB
       Interface : NVM Express
        Standard : NVM Express 1.4
   Transfer Mode : PCIe 3.0 x4 | PCIe 3.0 x4
  Power On Hours : 261 時間
  Power On Count : 238 回
      Host Reads : 791 GB
     Host Writes : 1060 GB
     Temperature : 44 C (111 F)
   Health Status : 正常 (100 %)
        Features : S.M.A.R.T., TRIM, VolatileWriteCache
    Drive Letter : C:

-- S.M.A.R.T. --------------------------------------------------------------
ID RawValues(6) Attribute Name
01 000000000000 クリティカルワーニング
02 00000000013D 温度
03 000000000064 予備領域
04 000000000001 予備領域 (しきい値)
05 000000000000 使用率
06 00000019503B 総読み込み量 (ホスト)
07 00000021F29F 総書き込み量 (ホスト)
08 000001429BC7 リードコマンド数 (ホスト)
09 0000021FCDBE ライトコマンド数 (ホスト)
0A 0000000000FB コントローラービジー時間
0B 0000000000EE 電源投入回数
0C 000000000105 使用時間
0D 000000000037 アンセーフシャットダウン回数
0E 000000000000 データエラー回数
0F 0000000001AA エラーログエントリー数

-- IDENTIFY_DEVICE ---------------------------------------------------------
        0    1    2    3    4    5    6    7    8    9
000: 1E4B 1E4B 3033 3830 3136 3435 3332 0030 0000 0000
010: 0000 0000 5553 454E 5341 2054 4553 3039 4E30 4756
020: 5133 3120 3230 4734 0000 0000 0000 0000 0000 0000
030: 0000 0000 3034 6630 4141 3231 0000 0000 0900 0000
040: 0400 0001 86A0 0001 8480 001E 0200 0000 0000 0000
050: 0000 0000 0000 0000 0000 0100 0000 0000 0000 0000
060: 0000 0000 0000 0000 0000 0000 0000 0000 0000 0000
070: 0000 0000 0000 0000 0000 0000 0000 0000 0000 0000
080: 0000 0000 0000 0000 0000 0000 0000 0000 0000 0000
090: 0000 0000 0000 0000 0000 0000 0000 0000 0000 0000
100: 0000 0000 0000 0000 0000 0000 0000 0000 0000 0000
110: 0000 0000 0000 0000 0000 0000 0000 0000 0000 0000
120: 0000 0000 0000 0000 0000 0000 0000 0000 0006 0302
130: 0314 043F 0101 016B 0170 0064 1000 0000 1000 0000
140: 6000 77A5 00EE 0000 0000 0000 0000 0000 0000 0000
150: 0000 0000 0000 0000 0000 0000 0000 0000 0000 0101
160: 0000 0001 0175 0184 0002 0000 0004 0000 0020 0000
170: 0000 0000 0000 0000 0000 0000 0000 0000 0000 0000
180: 0000 0000 0000 0000 0000 0000 0000 0000 0000 0000
190: 0000 0000 0000 0000 0000 0000 0000 0000 0000 0000
200: 0000 0000 0000 0000 0000 0000 0000 0000 0000 0000
210: 0000 0000 0000 0000 0000 0000 0000 0000 0000 0000
220: 0000 0000 0000 0000 0000 0000 0000 0000 0000 0000
230: 0000 0000 0000 0000 0000 0000 0000 0000 0000 0000
240: 0000 0000 0000 0000 0000 0000 0000 0000 0000 0000
250: 0000 0000 0000 0000 0000 0000

-- SMART_NVME --------------------------------------------------------------
     +0 +1 +2 +3 +4 +5 +6 +7 +8 +9 +A +B +C +D +E +F
000: 00 3D 01 64 01 00 00 00 00 00 00 00 00 00 00 00
010: 00 00 00 00 00 00 00 00 00 00 00 00 00 00 00 00
020: 3B 50 19 00 00 00 00 00 00 00 00 00 00 00 00 00
030: 9F F2 21 00 00 00 00 00 00 00 00 00 00 00 00 00
040: C7 9B 42 01 00 00 00 00 00 00 00 00 00 00 00 00
050: BE CD 1F 02 00 00 00 00 00 00 00 00 00 00 00 00
060: FB 00 00 00 00 00 00 00 00 00 00 00 00 00 00 00
070: EE 00 00 00 00 00 00 00 00 00 00 00 00 00 00 00
080: 05 01 00 00 00 00 00 00 00 00 00 00 00 00 00 00
090: 37 00 00 00 00 00 00 00 00 00 00 00 00 00 00 00
0A0: 00 00 00 00 00 00 00 00 00 00 00 00 00 00 00 00
0B0: AA 01 00 00 00 00 00 00 00 00 00 00 00 00 00 00
0C0: 00 00 00 00 00 00 00 00 43 01 44 01 45 01 46 01
0D0: 47 01 48 01 49 01 4A 01 00 00 00 00 00 00 00 00
0E0: 00 00 00 00 00 00 00 00 00 00 00 00 00 00 00 00
0F0: 00 00 00 00 00 00 00 00 00 00 00 00 00 00 00 00
100: 00 00 00 00 00 00 00 00 00 00 00 00 00 00 00 00
110: 00 00 00 00 00 00 00 00 00 00 00 00 00 00 00 00
120: 00 00 00 00 00 00 00 00 00 00 00 00 00 00 00 00
130: 00 00 00 00 00 00 00 00 00 00 00 00 00 00 00 00
140: 00 00 00 00 00 00 00 00 00 00 00 00 00 00 00 00
150: 00 00 00 00 00 00 00 00 00 00 00 00 00 00 00 00
160: 00 00 00 00 00 00 00 00 00 00 00 00 00 00 00 00
170: 00 00 00 00 00 00 00 00 00 00 00 00 00 00 00 00
180: 00 00 00 00 00 00 00 00 00 00 00 00 00 00 00 00
190: 00 00 00 00 00 00 00 00 00 00 00 00 00 00 00 00
1A0: 00 00 00 00 00 00 00 00 00 00 00 00 00 00 00 00
1B0: 00 00 00 00 00 00 00 00 00 00 00 00 00 00 00 00
1C0: 00 00 00 00 00 00 00 00 00 00 00 00 00 00 00 00
1D0: 00 00 00 00 00 00 00 00 00 00 00 00 00 00 00 00
1E0: 00 00 00 00 00 00 00 00 00 00 00 00 00 00 00 00
1F0: 00 00 00 00 00 00 00 00 00 00 00 00 00 00 00 00

----------------------------------------------------------------------------
 (02) INTEL SSDPEKNU512GZ
----------------------------------------------------------------------------
           Model : INTEL SSDPEKNU512GZ
        Firmware : 002C
   Serial Number : BTKA11441JAU512A
       Disk Size : 512.1 GB
       Interface : NVM Express
        Standard : NVM Express 1.4
   Transfer Mode : PCIe 3.0 x4 | PCIe 3.0 x4
  Power On Hours : 6619 時間
  Power On Count : 1202 回
      Host Reads : 21096 GB
     Host Writes : 22567 GB
     Temperature : 37 C (98 F)
   Health Status : 正常 (93 %)
        Features : S.M.A.R.T., TRIM, VolatileWriteCache
    Drive Letter : 

-- S.M.A.R.T. --------------------------------------------------------------
ID RawValues(6) Attribute Name
01 000000000000 クリティカルワーニング
02 000000000136 温度
03 000000000064 予備領域
04 00000000000A 予備領域 (しきい値)
05 000000000007 使用率
06 000002A31772 総読み込み量 (ホスト)
07 000002D22C45 総書き込み量 (ホスト)
08 000029856D17 リードコマンド数 (ホスト)
09 00001D8B7019 ライトコマンド数 (ホスト)
0A 000000003679 コントローラービジー時間
0B 0000000004B2 電源投入回数
0C 0000000019DB 使用時間
0D 000000000070 アンセーフシャットダウン回数
0E 000000000000 データエラー回数
0F 000000000000 エラーログエントリー数

-- IDENTIFY_DEVICE ---------------------------------------------------------
        0    1    2    3    4    5    6    7    8    9
000: 8086 8086 5442 414B 3131 3434 4A31 5541 3135 4132
010: 2020 2020 4E49 4554 204C 5353 5044 4B45 554E 3135
020: 4732 205A 2020 2020 2020 2020 2020 2020 2020 2020
030: 2020 2020 3030 4332 2020 2020 E406 5CD2 0600 0001
040: 0400 0001 A120 0007 4240 000F 0200 0000 0002 0000
050: 0000 0000 0000 0000 0000 0100 0000 0000 0000 0000
060: 0000 0000 0000 0000 0000 0000 0000 0000 0000 0000
070: 0000 0000 0000 0000 0000 0000 0000 0000 0000 0000
080: 0000 0000 0000 0000 0000 0000 0000 0000 0000 0000
090: 0000 0000 0000 0000 0000 0000 0000 0000 0000 0000
100: 0000 0000 0000 0000 0000 0000 0000 0000 0000 0000
110: 0000 0000 0000 0000 0000 0000 0000 0000 0000 0000
120: 0000 0000 0000 0000 0000 0000 0000 0000 0017 0703
130: 0F14 04FF 0100 015E 0161 0046 0000 0000 0000 0000
140: 0000 0000 0000 0000 0000 0000 0000 0000 0000 0000
150: 0000 0000 0000 0000 0000 0000 0000 0000 0005 0001
160: 0000 0001 012F 015E 0003 6000 0000 0000 0000 0000
170: 0000 0000 0000 0000 0000 0000 0000 0000 0000 0000
180: 0000 0000 0000 0000 0000 0000 0000 0000 0000 0000
190: 0000 0000 0000 0000 0000 0000 0000 0000 0000 0000
200: 0000 0000 0000 0000 0000 0000 0000 0000 0000 0000
210: 0000 0000 0000 0000 0000 0000 0000 0000 0000 0000
220: 0000 0000 0000 0000 0000 0000 0000 0000 0000 0000
230: 0000 0000 0000 0000 0000 0000 0000 0000 0000 0000
240: 0000 0000 0000 0000 0000 0000 0000 0000 0000 0000
250: 0000 0000 0000 0000 0000 0000

-- SMART_NVME --------------------------------------------------------------
     +0 +1 +2 +3 +4 +5 +6 +7 +8 +9 +A +B +C +D +E +F
000: 00 36 01 64 0A 07 00 00 00 00 00 00 00 00 00 00
010: 00 00 00 00 00 00 00 00 00 00 00 00 00 00 00 00
020: 72 17 A3 02 00 00 00 00 00 00 00 00 00 00 00 00
030: 45 2C D2 02 00 00 00 00 00 00 00 00 00 00 00 00
040: 17 6D 85 29 00 00 00 00 00 00 00 00 00 00 00 00
050: 19 70 8B 1D 00 00 00 00 00 00 00 00 00 00 00 00
060: 79 36 00 00 00 00 00 00 00 00 00 00 00 00 00 00
070: B2 04 00 00 00 00 00 00 00 00 00 00 00 00 00 00
080: DB 19 00 00 00 00 00 00 00 00 00 00 00 00 00 00
090: 70 00 00 00 00 00 00 00 00 00 00 00 00 00 00 00
0A0: 00 00 00 00 00 00 00 00 00 00 00 00 00 00 00 00
0B0: 00 00 00 00 00 00 00 00 00 00 00 00 00 00 00 00
0C0: 00 00 00 00 00 00 00 00 00 00 00 00 00 00 00 00
0D0: 00 00 00 00 00 00 00 00 00 00 00 00 00 00 00 00
0E0: 00 00 00 00 00 00 00 00 00 00 00 00 00 00 00 00
0F0: 00 00 00 00 00 00 00 00 00 00 00 00 00 00 00 00
100: 00 00 00 00 00 00 00 00 00 00 00 00 00 00 00 00
110: 00 00 00 00 00 00 00 00 00 00 00 00 00 00 00 00
120: 00 00 00 00 00 00 00 00 00 00 00 00 00 00 00 00
130: 00 00 00 00 00 00 00 00 00 00 00 00 00 00 00 00
140: 00 00 00 00 00 00 00 00 00 00 00 00 00 00 00 00
150: 00 00 00 00 00 00 00 00 00 00 00 00 00 00 00 00
160: 00 00 00 00 00 00 00 00 00 00 00 00 00 00 00 00
170: 00 00 00 00 00 00 00 00 00 00 00 00 00 00 00 00
180: 00 00 00 00 00 00 00 00 00 00 00 00 00 00 00 00
190: 00 00 00 00 00 00 00 00 00 00 00 00 00 00 00 00
1A0: 00 00 00 00 00 00 00 00 00 00 00 00 00 00 00 00
1B0: 00 00 00 00 00 00 00 00 00 00 00 00 00 00 00 00
1C0: 00 00 00 00 00 00 00 00 00 00 00 00 00 00 00 00
1D0: 00 00 00 00 00 00 00 00 00 00 00 00 00 00 00 00
1E0: 00 00 00 00 00 00 00 00 00 00 00 00 00 00 00 00
1F0: 00 00 00 00 00 00 00 00 00 00 00 00 00 00 00 00

